Date,S.N.,contract_id,symbol,buyer_broker,seller_broker,volume,price,amount,transaction_time
2025-09-18,6571,2025091805000247,TPC,Sani Securities Company Ltd.,Thrive Brokerage House Pvt. Ltd,10,321.2,3212.0,2025-09-18 11:00:40.124373
2025-09-18,6228,2025091805000377,TPC,Kohinoor Investment & Securities Pvt. Ltd.,Imperial Securities Company Pvt. Ltd.,100,316.0,31600.0,2025-09-18 11:01:28.044508
2025-09-18,4078,2025091805001117,TPC,Sweta Securities Private Limited,Online Securities Pvt. Ltd.,10,310.0,3100.0,2025-09-18 12:03:38.978326
2025-09-18,1327,2025091805001843,TPC,Sweta Securities Private Limited,Secured Securities Ltd.,60,310.0,18600.0,2025-09-18 12:05:16.965868
2025-09-18,581,2025091805002051,TPC,Sani Securities Company Ltd.,Asian Securities Private Ltd.,100,311.0,31100.0,2025-09-18 12:05:46.860326
